survey identifiers,,survey description,,,,"narrative parameters
",,,,,,,,,,,,,,,,,,,,,,,,,,,,,,,,,,,respondent characteristics,,,,,survey responses,,,,,,,,,,,,,,
5,"VS-p, SB-vo, GWH-sp",SB-vo,SB,vo,6,45-54,couple+kids,,10,frugal,intense,,above average,Car loans/private school tuition,35,good,5400,8400,28,1,no,yes,2x4 batt R13,28,single 0.48,28,blown R15,28,0.75,ng,28,0.95,electric,3,,None,,middle,well maintained,no,5,,3,7,5,5,1,1,1,2,3,1,"Achieving Step 3 or greater would require improved air tightness and most importantly, central ventilation through an HRV. Adding HRV ducting to an existing home seems unlikely to me. In addition, the home would require major updates to the building envelope thermal performance as well as air tightness. I don't believe these are likely to happen due to the cost","Conventional financing mechanism such as grants or tax abatements.,Innovative financing mechanisms such as attaching loans to meter savings.,Please specify:",5,6,9,4,"Again, it comes down to the fact that to achieve high performance, major renovations would be required. At some point it is easier and more cost effective to replace the home entirely, which seems more likely with the land prices in Vancouver, particularly if this home on a large lot is replaced with a duplex or other more dense housing.",53
5,"VS-p, SB-vo, GWH-sp",GWH-sp,GWH,sp,3,65-74,couple,,20,frugal,some,,average,None mentioned,0,fair,3000,3135,108,below 1,yes,yes,2x4 batt R13,29,single 0.48,29,blown R15,29,unknown,ng/electric,29,0.75,ng,29,,None,,very leaky,well maintained,no,5,,3,7,5,2,1,1,1,1,2,4,Wondering what value is placed on the heritage of this vintage of home. It may lead to someone deciding to do a deep retrofit rather than tear down and rebuild.,"An education campaign for owners and practitioners on potential savings and best practices.,Conventional financing mechanism such as grants or tax abatements.,Innovative financing mechanisms such as attaching loans to meter savings.",4,5,6,3,,54
4,"VS-sp, MP-vp, GWH-so",VS-sp,VS,sp,3,45-54,couple,,5,thrifty,none,,average,None mentioned,10,good,2600,4000,44,1,no,no,2x4 batt R13,19,single 0.48,19,blown R15,19,0.85,ng,8,0.85,ng,8,,None,,leaky,average,no,7,,6,7,7,1,1,1,1,2,2,7,"electrification, and perhaps rebuilt","A public financing scheme such as a provincial 'Green Bank'.,Aggregation of individual retrofit projects into packages.,Please specify:",2,3,9,3,"It's important to consider economic viability and social equity in developing related policies or incentives.
 
 
 Repeated from input above:
 Economic incentives through allowing additional living space/suite when retrofitted to Step 5.There's opportunity for co-benefits with improving seismic resilience and housing affordability. Allowing two or more adjacent buildings to be retrofitted into a rowhouse strata, adding ""infill units"" in between the original houses i.e. turning side yards into small homes.We'll then only need to ""upgrade"" the exterior walls along the front and back of the buildings and extend them to close off the sideyards.There would not be a need to upgrade the side walls between the existing buildings. The additional small homes created will be an economic incentive to make the Step 5 retrofits viable.",55
4,"VS-sp, MP-vp, GWH-so",MP-vp,MP,vp,1,55-64,couple,,25,frugal,intense,They have recently begun to think more about their personal climate change impact and are starting to make purchasing and lifestyle decisions that reduce their footprint.,average,small medical bill that is being steadily paid down,5,good,2100,4000,67,1,no,no,2x4 batt R13,14,double 0.48,29,blown R15,29,0.75,ng,29,0.75,ng,29,,None,,leaky,average,no,7,,6,7,7,1,1,1,1,2,2,7,"electrification, and likely new construction","A public financing scheme such as a provincial 'Green Bank'.,Aggregation of individual retrofit projects into packages.,Please specify:",2,3,9,3,"It's important to consider economic viability and social equity in developing related policies or incentives.
 
 
 Repeated from input above:
 Economic incentives through allowing additional living space/suite when retrofitted to Step 5.There's opportunity for co-benefits with improving seismic resilience and housing affordability. Allowing two or more adjacent buildings to be retrofitted into a rowhouse strata, adding ""infill units"" in between the original houses i.e. turning side yards into small homes.We'll then only need to ""upgrade"" the exterior walls along the front and back of the buildings and extend them to close off the sideyards.There would not be a need to upgrade the side walls between the existing buildings. The additional small homes created will be an economic incentive to make the Step 5 retrofits viable.",56
4,"VS-sp, MP-vp, GWH-so",GWH-so,GWH,so,4,45-54,couple,,1,generous,intense,,above average,Car loan,30,good,3000,3135,108,below 1,no,yes,2x4 batt R13,29,single 0.48,29,blown R15,29,unknown,ng/electric,29,0.75,ng,29,,None,,very leaky,average,no,7,,6,7,7,3,2,1,1,6,3,7,"electrification, with upgrade to building envelop, windows and mechanical systems; also considering home character and size for a relatively small lot.","An energy disclosure mandate with a benchmarking, audit, and labeling protocol.,A public financing scheme such as a provincial 'Green Bank'.,Aggregation of individual retrofit projects into packages.",1,2,3,4,"Despite the possible high motivation of these homeowners to improve the environmental performance of their home, it's still very important to consider economic viability and social equity in developing related policies or incentives.",57
2,"VS-o, MP-sp, GWH-vo",VS-o,VS,o,5,45-54,couple+kids+other,,7,thrifty,intense,,above average,None mentioned but concerned with son's college fund,32,good,2600,4000,44,1,no,yes,2x4 batt R13,19,single 0.48,19,blown R15,19,0.85,ng,8,0.85,ng,8,,None,,leaky,average,no,7,,2,7,5,5,4,4,3,4,2,5,"Bias - I expect policy to mandate heat pumps by 2035, so decarbonize via fuel switch, not energy efficiency","An energy disclosure mandate with a benchmarking, audit, and labeling protocol.,The creation of an integrated public retrofit servicing agency.,The implementation of a Retrofit Code for energy, emissions, and safety upgrades.",1,7,8,3,,58
2,"VS-o, MP-sp, GWH-vo",MP-sp,MP,sp,3,35-44,couple+kids,,0,frugal,some,They factor reducing their environmental footprint in purchasing of goods. ,average,40% of net monthly income goes to mortgage,40,good,2100,4000,67,1,no,yes,2x4 batt R13,14,double 0.48,14,blown R15,22,0.75,ng,22,0.75,ng,22,,None,,leaky,poor,no,7,,2,7,5,4,3,2,1,3,3,5,See previous comment about heat pumps,"An energy disclosure mandate with a benchmarking, audit, and labeling protocol.,The creation of an integrated public retrofit servicing agency.,The implementation of a Retrofit Code for energy, emissions, and safety upgrades.",1,7,8,3,,59
2,"VS-o, MP-sp, GWH-vo",GWH-vo,GWH,vo,6,45-54,couple+kids,,3,generous,intense,,average,None mentioned,0,fair,3000,3135,108,below 1,no,yes,2x4 batt R13,40,single 0.48,40,blown R15,40,unknown,ng/electric,29,0.75,ng,29,,None,,very leaky,well maintained,no,7,,2,7,5,5,4,3,3,4,1,5,See previous,"An energy disclosure mandate with a benchmarking, audit, and labeling protocol.,The creation of an integrated public retrofit servicing agency.,The implementation of a Retrofit Code for energy, emissions, and safety upgrades.",1,7,8,3,,60
2,"VS-o, MP-sp, GWH-vo",VS-o,VS,o,5,45-54,couple+kids+other,,7,thrifty,intense,,above average,None mentioned but concerned with son's college fund,32,good,2600,4000,44,1,no,yes,2x4 batt R13,19,single 0.48,19,blown R15,19,0.85,ng,8,0.85,ng,8,,None,,leaky,average,no,7,,2,7,6,4,1,1,1,4,2,4,"I assume the house would be torn down and re-built within 5-7 years due to age of building/system and occupants (father likely passed away, son likely moved out). Under existing/anticipated policy within this timeframe, gas heating is still allowed, and fossil gas has artificially low rates due to subsidization of the industry. Therefore, with higher costs of heat pumps, there is no major driver to go zero carbon at this time. On the other hand, as the family is environmentally minded they may choose this direction.","An energy disclosure mandate with a benchmarking, audit, and labeling protocol.,The implementation of a Retrofit Code for energy, emissions, and safety upgrades.,Please specify:",1,8,8,3,Incentives are fine as supporting mechanisms but ultimately we need clear regulation to get off fossil fuels. Also there is often conflation of energy efficiency with GHG reduction. Energy efficiency alone is not enough to reduce CO2 in line with CoV's new climate commitments.,61
2,"VS-o, MP-sp, GWH-vo",MP-sp,MP,"sp
",1,55-64,couple,,25,frugal,intense,They have recently begun to think more about their personal climate change impact and are starting to make purchasing and lifestyle decisions that reduce their footprint.,average,small medical bill that is being steadily paid down,5,good,2100,4000,67,1,no,no,2x4 batt R13,14,double 0.48,29,blown R15,29,0.75,ng,29,0.75,ng,29,,None,,leaky,average,no,7,,2,7,6,2,1,1,1,1,2,4,"Seems unlikely this family will live in the same house for 30 years, and/or significantly invest in upgrades, therefore demolish/rebuild either under their ownership or another seems likely. Whether or not it is carbon neutral depends mostly on when it rebuilds and what the city policy is at that time.","An education campaign for owners and practitioners on potential savings and best practices.,The creation of an integrated public retrofit servicing agency.,The implementation of a Retrofit Code for energy, emissions, and safety upgrades.",4,7,8,3,,62
2,"VS-o, MP-sp, GWH-vo",GWH-vo,GWH,vo,6,45-54,couple+kids,,3,generous,intense,,average,None mentioned,0,fair,3000,3135,108,below 1,no,yes,2x4 batt R13,40,single 0.48,40,blown R15,40,unknown,ng/electric,29,0.75,ng,29,,None,,very leaky,well maintained,no,7,,2,7,6,5,4,2,1,5,3,6,"The building has a high aesthetic and heritage value. It is already heated primarily with electricity, and would be a good candidate for and air source heat pump retrofit.","An education campaign for owners and practitioners on potential savings and best practices.,The creation of an integrated public retrofit servicing agency.,The implementation of a Retrofit Code for energy, emissions, and safety upgrades.",4,7,8,3,,63
1,"VS-vo, MP-so, SB-vp",VS-vo,VS,vo,6,55-64,couple,,13,thrifty,intense,,above average,None mentioned,25,excellent,2600,4000,44,1,no,yes,2x4 batt R13,19,single 0.48,19,blown R15,19,0.85,ng,19,0.85,ng,19,,None,,leaky,well maintained,no,5,,3,5,5,5,4,3,2,5,2,4,"if the couple has undertaken retrofits in the past and is conscientious about their environmental impact, they will likely undertake future retrofits. Plus, if the couple downsizes and sells the house, it will likely be torn down, given its age.","A public financing scheme such as a provincial 'Green Bank'.,The creation of an integrated public retrofit servicing agency.,The implementation of a Retrofit Code for energy, emissions, and safety upgrades.",2,7,8,3,,64
1,"VS-vo, MP-so, SB-vp",MP-so,MP,so,4,35-44,couple,,0,thrifty,none,,above average,40% of net monthly income goes to mortgage,40,good,2100,4000,67,1,no,yes,2x4 batt R13,14,double 0.48,14,blown R15,22,0.75,ng,22,0.75,ng,22,,None,,leaky,average,yes,5,,3,5,5,3,2,1,1,2,3,4,"The family likely won't be able to finance a major retrofit, and sounds like they may be there for the long term. Achieving Step 5 would require a major building renovation including envelop, which is a very expensive investment that doesn't see a payback.","A public financing scheme such as a provincial 'Green Bank'.,Innovative financing mechanisms such as attaching loans to meter savings.,The implementation of a Retrofit Code for energy, emissions, and safety upgrades.",2,6,8,3,,65
1,"VS-vo, MP-so, SB-vp",SB-vp,SB,vp,1,45-54,couple+kids,,10,generous,some,,above average,2nd mortgage 10% of budget,30,,5400,8400,28,1,no,yes,2x4 batt R13,28,single 0.48,28,blown R15,28,0.75,ng,28,0.95,electric,3,,None,,middle,well maintained,no,5,,3,5,5,6,5,4,4,5,2,5,"If the couple downsizes after the kids move out in the next 10 years, the house will likely be rebuilt (since it's in Shaughnessy, the added cost of rebuilding would be relatively small compared to the price of the property). If regulations require high efficiency new builds, the house could achieve high levels on the Step Code.","Conventional financing mechanism such as grants or tax abatements.,The creation of an integrated public retrofit servicing agency.,The implementation of a Retrofit Code for energy, emissions, and safety upgrades.",5,7,8,3,"Like most existing buildings, the cost of retrofitting the building to achieve Step 5 would probably be better spent rebuilding the house with passive features incorporated. You can't retrofit the shape of a house to optimize window placement to catch light and wind. If Part 9 Code requires ""passive ready"" design, it's more likely a house will be carbon neutral by 2050.",66
